delivery_time,feedback,hourlie,name_reviewer,price,sales_num,location,favorites,time,star_review,reviews_num,FLNCR_RSPN_CMMT,review,rating_perc,,Cleaned_Review,Label,pos,neutral,Keywords,Review_Label
1,,Produce 10 very deep SEO and website analysis reports within 24 hours!,Emma W.,$15,63,"Leeds, United Kingdom            ",41,27-Jul-15,5,50,,"<p>Thanks Kevin, great job. Really fast and efficient and very useful reports. Thanks again. </p>",98%,,"Thanks Kevin, great job. Really fast and efficient and very useful reports. Thanks again. ",neutral,0.490448001,0.595089061,"['Thanks', 'Kevin', 'great', 'job', 'Really', 'fast', 'efficient', 'very', 'useful', 'reports', 'Thanks', 'again']",Quality
1,,Produce 10 very deep SEO and website analysis reports within 24 hours!,Debbie S.,$15,63,"Weston-super-Mare, United Kingdom            ",41,23-Jul-15,5,50,,<p>Kevin made alterations to my website to make it more SEO user friendly.</p>,98%,,Kevin made alterations to my website to make it more SEO user friendly.,pos,0.840655458,0.250358729,"['Kevin', 'made', 'alterations', 'website', 'make', 'more', 'SEO', 'user', 'friendly']",Quality
1,,Produce 10 very deep SEO and website analysis reports within 24 hours!,Nick W.,$15,63,"Exeter, United Kingdom            ",41,23-Jul-15,5,50,,<p>Good work.  Excellent understanding of the problem and the need for a bespoke solution not a 'one size fits all' template.</p>,98%,,Good work.  Excellent understanding of the problem and the need for a bespoke solution not a 'one size fits all' template.,neg,0.339263726,0.178095782,"['Good', 'work', 'Excellent', 'understanding', 'problem', 'need', 'bespoke', 'solution', 'not', ""'one"", 'size', 'fits', 'template']",Quality
1,,Produce 10 very deep SEO and website analysis reports within 24 hours!,Nick W.,$15,63,"Exeter, United Kingdom            ",41,12-Jul-15,4,50,,<p>Excellent.  There is more work to come.</p>,98%,,Excellent.  There is more work to come.,pos,0.632785664,0.07270317,"['Excellent', 'is', 'more', 'work', 'come']",Quality
1,,Produce 10 very deep SEO and website analysis reports within 24 hours!,Akwasi B.,$15,63,"Walton, United Kingdom            ",41,30-Jun-15,5,50,,"<p>very happy with kevin's work, detailed and thorough plus great communication</p>",98%,,"very happy with kevin's work, detailed and thorough plus great communication",pos,0.649077811,0.143763215,"['very', 'happy', 'kevin', 'work', 'detailed', 'plus', 'great', 'communication']",Quality
1,,Produce 10 very deep SEO and website analysis reports within 24 hours!,Paul A.,$15,63,"Wallasey, United Kingdom            ",41,24-Jun-15,5,50,,"<p>5* - super fast service as always !<br>
Top company.</p>",98%,,5* - super fast service as always ! Top company.,pos,0.8940048,0.09300939,"['5*', 'super', 'fast', 'service', 'always', 'Top', 'company']",Time
1,,Produce 10 very deep SEO and website analysis reports within 24 hours!,Jane V.,$15,63,"Shipley, United Kingdom            ",41,23-Jun-15,5,50,,<p>fast delivery. Thanks!</p>,98%,,fast delivery. Thanks!,neutral,0.614979063,0.575209484,"['fast', 'delivery', 'Thanks']",Time
1,,Produce 10 very deep SEO and website analysis reports within 24 hours!,Nick W.,$15,63,"Exeter, United Kingdom            ",41,11-Jun-15,5,50,,<p>Excellent.  Now I/we need interpret this very useful data into SEO positive action.</p>,98%,,Excellent.  Now I/we need interpret this very useful data into SEO positive action.,pos,0.717965607,0.33142959,"['Excellent', 'Now', 'I/we', 'need', 'interpret', 'very', 'useful', 'data', 'SEO', 'positive', 'action']",Quality
1,,Produce 10 very deep SEO and website analysis reports within 24 hours!,Ghost of M.,$15,63,"Belfast, United Kingdom            ",41,10-Jun-15,5,50,,<p>Great working with Kevin :)</p>,98%,,Great working with Kevin :),pos,0.614779523,0.199131162,"['Great', 'working', 'Kevin']",Quality
1,,Produce 10 very deep SEO and website analysis reports within 24 hours!,KC C.,$15,63,"Kuala Lumpur, Malaysia            ",41,04-Jun-15,4,50,,<p>Detailed analysis. Thanks.</p>,98%,,Detailed analysis. Thanks.,neutral,0.644361492,0.581002974,"['Detailed', 'analysis', 'Thanks']",Quality
1,,Analyse your website,John C.,$60,2,"Dublin, Ireland            ",,19-Jun-15,5,2,,"<p>Excellent job - have already used Abhishek for an additional task and will keep his details on file for future use.<br>
<br>
He knows his stuff and we're very happy with his enthusiasm, availability and support.</p>",100%,,"Excellent job - have already used Abhishek for an additional task and will keep his details on file for future use.  He knows his stuff and we're very happy with his enthusiasm, availability and support.",pos,0.66987648,0.283351938,"['Excellent', 'job', 'have', 'already', 'used', 'Abhishek', 'additional', 'task', 'will', 'keep', 'details', 'file', 'future', 'use', 'knows', 'stuff', ""'re"", 'very', 'happy', 'enthusiasm', 'availability', 'support']",Quality
1,,Analyse your website,John C.,$60,2,"Dublin, Ireland            ",,05-Jun-15,5,2,,"<p>Excellent analysis of our website with great suggestions on how to improve it. Abhiskeh is working closely with us to promote the site and ensure a high ranking in searches.<br>
Very happy and have started a second project with him.</p>",100%,,Excellent analysis of our website with great suggestions on how to improve it. Abhiskeh is working closely with us to promote the site and ensure a high ranking in searches. Very happy and have started a second project with him.,pos,0.858398092,0.48340322,"['Excellent', 'analysis', 'website', 'great', 'suggestions', 'how', 'improve', 'Abhiskeh', 'is', 'working', 'closely', 'promote', 'site', 'ensure', 'high', 'ranking', 'searches', 'Very', 'happy', 'have', 'started', 'second', 'project']",Quality
5,,Deliver a complete SEO link building package tailored to top rankings. 1 month SEO,Lawrence P.,$100,1,"Bangor, United Kingdom            ",5,19-Jun-15,5,1,,<p>Alick thanks for a great job.. i will definitely use and again and highly recommend   </p>,100%,,Alick thanks for a great job.. i will definitely use and again and highly recommend   ,neutral,0.771693433,0.691765557,"['Alick', 'thanks', 'great', 'job..', 'will', 'definitely', 'use', 'again', 'highly', 'recommend']",Quality
5,,Give the best all in one ultimate SEO service with site Audit,Andrew M.,$31,7,"Stockport, United Kingdom            ",6,04-Jul-15,5,3,,"<p>Fantastic SEO work and prompt replies, they took care of the job well. </p>",100%,,"Fantastic SEO work and prompt replies, they took care of the job well. ",pos,0.871877608,0.14433014,"['Fantastic', 'SEO', 'work', 'prompt', 'replies', 'took', 'care', 'job', 'well']",Time
5,,Give the best all in one ultimate SEO service with site Audit,Max L.,$31,7,"New York City, United States            ",6,14-Jun-15,5,3,,<p>Solid work</p>,100%,,Solid work,neutral,0.763619859,0.654977781,"['Solid', 'work']",Quality
5,,Give the best all in one ultimate SEO service with site Audit,M J.,$31,7,"City of London, United Kingdom            ",6,08-Jun-15,5,3,,<p>wow very fast and reliable service I got good result from this  great communication will order more  thank you very  much</p>,100%,,wow very fast and reliable service I got good result from this  great communication will order more  thank you very  much,pos,0.564153532,0.376975288,"['wow', 'very', 'fast', 'reliable', 'service', 'got', 'good', 'result', 'great', 'communication', 'will', 'order', 'more', 'thank', 'very', 'much']",Time
2,,Export all organic keywords of 10 websites,Knight Caslte M.,$20,3,"City of London, United Kingdom            ",3,22-Jun-15,5,1,,<p>Amazing and Talented. I will be using him again</p>,100%,,Amazing and Talented. I will be using him again,pos,0.757001431,0.141527979,"['Amazing', 'Talented', 'will', 'be', 'using', 'again']",Quality
2,,Spy on your competitors backlinks and provide you with a PDF report,Upol Z.,$31,1,"Riyadh, Saudi Arabia            ",,16-Jun-15,5,1,,<p>I'm satisfied with his report :)</p>,100%,,I'm satisfied with his report :),pos,0.782491779,0.199511649,"[""'m"", 'satisfied', 'report']",Time
7,,Phase 2 - Full SEO Health check,Michele M.,$247,3,"London, United Kingdom            ",,25-May-15,5,1,,<p>Very helpful audit even for SEO-savvy people like us! Have requested a second one for a different site.</p>,100%,,Very helpful audit even for SEO-savvy people like us! Have requested a second one for a different site.,neg,0.49289546,0.258773967,"['Very', 'helpful', 'audit', 'even', 'SEO-savvy', 'people', 'Have', 'requested', 'second', 'one', 'different', 'site']",Quality
1,,Produce 10 very deep SEO and website analysis reports within 24 hours!,Frankie B.,$15,63,"City of London, United Kingdom            ",41,27-May-15,5,50,,<p>Great!</p>,98%,,Great!,pos,0.665527482,0.27130788,['Great'],Quality
1,,Produce 10 very deep SEO and website analysis reports within 24 hours!,Frankie B.,$15,63,"City of London, United Kingdom            ",41,18-May-15,5,50,,<p>Very Good! Although there is a lot I do not understand I am hoping someone else does!</p>,98%,,Very Good! Although there is a lot I do not understand I am hoping someone else does!,pos,0.723649802,0.271190505,"['Very', 'Good', 'Although', 'there', 'is', 'lot', 'do', 'not', 'understand', 'am', 'hoping', 'someone', 'else', 'does']",Quality
1,,Produce 10 very deep SEO and website analysis reports within 24 hours!,Jacqui S.,$15,63,"Sheffield, United Kingdom            ",41,13-May-15,5,50,,<p>top job &amp  fast service</p>,98%,,top job &  fast service,pos,0.502273069,0.074586202,"['top', 'job', 'fast', 'service']",Time
1,,Produce 10 very deep SEO and website analysis reports within 24 hours!,Paul A.,$15,63,"Wallasey, United Kingdom            ",41,08-May-15,5,50,,<p>5* Job again... great reviews... very helpful in sorting out website issues.</p>,98%,,5* Job again... great reviews... very helpful in sorting out website issues.,neutral,0.625079154,0.633227714,"['5*', 'Job', 'again', 'great', 'reviews', 'very', 'helpful', 'sorting', 'website', 'issues']",Quality
1,,Produce 10 very deep SEO and website analysis reports within 24 hours!,Steven L.,$15,63,"Montreal, Canada            ",41,07-May-15,5,50,,"<p>Was fast and concise, I would use this member again.</p>",98%,,"Was fast and concise, I would use this member again.",neutral,0.575987158,0.526403866,"['Was', 'fast', 'concise', 'would', 'use', 'member', 'again']",Time
1,,Produce 10 very deep SEO and website analysis reports within 24 hours!,Italo O.,$15,63,"Johannesburg, South Africa            ",41,04-May-15,5,50,,<p>Great work from Kev</p>,98%,,Great work from Kev,neg,0.456338512,0.178223167,"['Great', 'work', 'Kev']",Quality
1,,Produce 10 very deep SEO and website analysis reports within 24 hours!,Michael D.,$15,63,"Exeter, United Kingdom            ",41,04-May-15,5,50,,<p>That was quick! I'm impressed with the detail... I'll look into your suggestions asap!</p>,98%,,That was quick! I'm impressed with the detail... I'll look into your suggestions asap!,pos,0.731914438,0.251511915,"['was', 'quick', ""'m"", 'impressed', 'detail', ""'ll"", 'look', 'suggestions', 'asap']",Time
1,,Produce 10 very deep SEO and website analysis reports within 24 hours!,Michael D.,$15,63,"Exeter, United Kingdom            ",41,04-May-15,5,50,,<p>That was quick! I'm impressed with the detail... I'll look into your suggestions asap!</p>,98%,,That was quick! I'm impressed with the detail... I'll look into your suggestions asap!,pos,0.746904042,0.098783272,"['was', 'quick', ""'m"", 'impressed', 'detail', ""'ll"", 'look', 'suggestions', 'asap']",Time
1,,Produce 10 very deep SEO and website analysis reports within 24 hours!,Nick M.,$15,63,"Addlestone, United Kingdom            ",41,04-May-15,5,50,,<p>thanks </p>,98%,,thanks ,pos,0.746904042,0.098783272,['thanks'],Quality
1,,Produce 10 very deep SEO and website analysis reports within 24 hours!,Debbie S.,$15,63,"Weston-super-Mare, United Kingdom            ",41,30-Apr-15,5,50,,<p>Excellent. Did as required very quickly.</p>,98%,,Excellent. Did as required very quickly.,pos,0.671327164,0.398096257,"['Excellent', 'Did', 'required', 'very', 'quickly']",Time
1,,Produce 10 very deep SEO and website analysis reports within 24 hours!,Nathan P.,$15,63,"Leeds, United Kingdom            ",41,30-Apr-15,5,50,,"<p>Fantastic service, completed the report within an hour and was very comprehensive!<br>
Highly reccomended</p>",98%,,"Fantastic service, completed the report within an hour and was very comprehensive! Highly reccomended",pos,0.649335454,0.265872018,"['Fantastic', 'service', 'completed', 'report', 'hour', 'was', 'very', 'comprehensive', 'Highly', 'reccomended']",Time
1,,Produce 10 very deep SEO and website analysis reports within 24 hours!,Derek C.,$15,63,"London, United Kingdom            ",41,29-Apr-15,5,50,,<p>Fantastic work once again and will be back shortly</p>,98%,,Fantastic work once again and will be back shortly,pos,0.576385782,0.367196719,"['Fantastic', 'work', 'once', 'again', 'will', 'be', 'back', 'shortly']",Quality
1,,Produce 10 very deep SEO and website analysis reports within 24 hours!,D.M S.,$15,63,"London, United Kingdom            ",41,29-Apr-15,4,50,,<p>Thanks Kevin</p>,98%,,Thanks Kevin,neutral,0.625666397,0.565721379,"['Thanks', 'Kevin']",Quality
1,,Produce 10 very deep SEO and website analysis reports within 24 hours!,Dave M.,$15,63,"Ontario, United States            ",41,29-Apr-15,4,50,,<p>Great report in super fast time!!!</p>,98%,,Great report in super fast time!!!,pos,0.611715813,0.357954111,"['Great', 'report', 'super', 'fast', 'time']",Time
1,,Produce 10 very deep SEO and website analysis reports within 24 hours!,Ian B.,$15,63,"San Francisco, United States            ",41,29-Apr-15,4,50,,<p>Kevin was quick and helpful.  The report proved to be very informative and has driven several changes we have already put into place to enhance SEO.</p>,98%,,Kevin was quick and helpful.  The report proved to be very informative and has driven several changes we have already put into place to enhance SEO.,pos,0.671079594,0.416387371,"['Kevin', 'was', 'quick', 'helpful', 'report', 'proved', 'be', 'very', 'informative', 'has', 'driven', 'several', 'changes', 'have', 'already', 'put', 'place', 'enhance', 'SEO']",Time
1,,Produce 10 very deep SEO and website analysis reports within 24 hours!,Alexander W.,$15,63,"Zurich, Switzerland            ",41,28-Apr-15,5,50,,"<p>Work was done excpected, thank you! </p>",98%,,"Work was done excpected, thank you! ",neutral,0.524190343,0.649908008,"['Work', 'was', 'done', 'excpected', 'thank']",Quality
1,,Produce 10 very deep SEO and website analysis reports within 24 hours!,Paul A.,$15,63,"Wallasey, United Kingdom            ",41,28-Apr-15,5,50,,<p>Top rate service - completed in less than an hour... 5*</p>,98%,,Top rate service - completed in less than an hour... 5*,pos,0.548810932,0.392337499,"['Top', 'rate', 'service', 'completed', 'less', 'hour', '5*']",Time
1,,Produce 10 very deep SEO and website analysis reports within 24 hours!,Paul A.,$15,63,"Wallasey, United Kingdom            ",41,28-Apr-15,5,50,,"<p>5* - Super fast service - very intertesting information.<br>
Will be a regular customer</p>",98%,,5* - Super fast service - very intertesting information. Will be a regular customer,neg,0.277410652,0.296718226,"['5*', 'Super', 'fast', 'service', 'very', 'intertesting', 'information', 'Will', 'be', 'regular', 'customer']",Time
1,,Produce 10 very deep SEO and website analysis reports within 24 hours!,Joshua A.,$15,63,"Stellenbosch, South Africa            ",41,24-Apr-15,5,50,,<p>Highly recommend.</p>,98%,,Highly recommend.,neutral,0.515409168,0.64178576,"['Highly', 'recommend']",Quality
1,,Produce 10 very deep SEO and website analysis reports within 24 hours!,Jason H.,$15,63,"Dolgellau, United Kingdom            ",41,24-Apr-15,5,50,,"<p>Delighted - thank you.<br>
Quick as well.</p>",98%,,Delighted - thank you. Quick as well.,pos,0.620498536,0.441934204,"['Delighted', 'thank', 'Quick', 'well']",Time
1,,Produce 10 very deep SEO and website analysis reports within 24 hours!,Derek C.,$15,63,"London, United Kingdom            ",41,23-Apr-15,5,50,,<p>Can't recommend Kevin enough. Always delivers on time and good quality work</p>,98%,,Can't recommend Kevin enough. Always delivers on time and good quality work,pos,0.707010538,0.176169758,"['Ca', ""n't"", 'recommend', 'Kevin', 'enough', 'Always', 'delivers', 'time', 'good', 'quality', 'work']",Quality
1,,Produce 10 very deep SEO and website analysis reports within 24 hours!,Edward R.,$15,63,"Taunton, United Kingdom            ",41,23-Apr-15,5,50,,<p>Kevin's report came through in very useful detail and within 30 minutes...very happy with the service.</p>,98%,,Kevin's report came through in very useful detail and within 30 minutes...very happy with the service.,pos,0.559420113,0.203821403,"['Kevin', 'report', 'came', 'very', 'useful', 'detail', '30', 'minutes', 'very', 'happy', 'service']",Time
1,,Produce 10 very deep SEO and website analysis reports within 24 hours!,Plus I.,$15,63,"London, United Kingdom            ",41,23-Apr-15,5,50,,<p>Kevin supplied plusidol.com a fast and exhaustive report in record time! Highly recommended.</p>,98%,,Kevin supplied plusidol.com a fast and exhaustive report in record time! Highly recommended.,pos,0.70302186,0.416259477,"['Kevin', 'supplied', 'plusidol.com', 'fast', 'exhaustive', 'report', 'record', 'time', 'Highly', 'recommended']",Time
1,,Produce 10 very deep SEO and website analysis reports within 24 hours!,William L.,$15,63,"Montreal, Canada            ",41,23-Apr-15,5,50,,<p>SEO report provided as expected.</p>,98%,,SEO report provided as expected.,pos,0.763170623,0.315017374,"['SEO', 'report', 'provided', 'expected']",Quality
1,,Produce 10 very deep SEO and website analysis reports within 24 hours!,Robert S.,$15,63,"Royston, United Kingdom            ",41,23-Apr-15,5,50,,"<p>""Within 24-Hours""??  More like within 24 minutes.  Great report &amp; super quick. </p>",98%,,"""Within 24-Hours""??  More like within 24 minutes.  Great report &; super quick. ",neg,0.464293817,0.461005873,"['24-Hours', 'More', '24', 'minutes', 'Great', 'report', 'super', 'quick']",Time
1,,Produce 10 very deep SEO and website analysis reports within 24 hours!,Alexander W.,$15,63,"Zurich, Switzerland            ",41,22-Apr-15,5,50,,<p>Fascinating report produced within a couple of hours. Great service! </p>,98%,,Fascinating report produced within a couple of hours. Great service! ,pos,0.52226626,0.162542031,"['Fascinating', 'report', 'produced', 'couple', 'hours', 'Great', 'service']",Time
1,,Produce 10 very deep SEO and website analysis reports within 24 hours!,Paul R.,$15,63,"City of London, United Kingdom            ",41,22-Apr-15,5,50,,"<p>Exceptionally fast turnaround and a very affordable, interesting report.</p>",98%,,"Exceptionally fast turnaround and a very affordable, interesting report.",pos,0.876368944,0.118319477,"['Exceptionally', 'fast', 'turnaround', 'very', 'affordable', 'interesting', 'report']",Time
1,,Produce 10 very deep SEO and website analysis reports within 24 hours!,Italo O.,$15,63,"Johannesburg, South Africa            ",41,22-Apr-15,5,50,,<p>Quick turn around time and great report.</p>,98%,,Quick turn around time and great report.,pos,0.615104352,0.210584586,"['Quick', 'turn', 'time', 'great', 'report']",Time
1,,Produce 10 very deep SEO and website analysis reports within 24 hours!,Skye H.,$15,63,"Worcester Park, United Kingdom            ",41,21-Apr-15,4,50,,<p>Very prompt service (as promised) and very thorough.  Thankyou.   </p>,98%,,Very prompt service (as promised) and very thorough.  Thankyou.   ,pos,0.744859734,0.485207201,"['Very', 'prompt', 'service', 'promised', 'very', 'thorough', 'Thankyou']",Time
1,,Produce 10 very deep SEO and website analysis reports within 24 hours!,Jamie C.,$15,63,"Cullompton, United Kingdom            ",41,21-Apr-15,5,50,,<p>Really good report. Much appreciated. Especially for such a low fee. </p>,98%,,Really good report. Much appreciated. Especially for such a low fee. ,pos,0.645193949,0.399211863,"['Really', 'good', 'report', 'Much', 'appreciated', 'Especially', 'such', 'low', 'fee']",Money
1,,Produce 10 very deep SEO and website analysis reports within 24 hours!,El C.,$15,63,"London, United Kingdom            ",41,20-Apr-15,5,50,,"<p>A really easy to understand report and delivered very fast - thank you!<br>
</p>",98%,,A really easy to understand report and delivered very fast - thank you! ,pos,0.679341827,0.146190084,"['really', 'easy', 'understand', 'report', 'delivered', 'very', 'fast', 'thank']",Time
1,,Produce 10 very deep SEO and website analysis reports within 24 hours!,Samuel L.,$15,63,"Berlin, Germany            ",41,20-Apr-15,5,50,,"<p>Excellent work provided by Kevin. It's worth much more than the price he's selling it, so you won't regret it ! It's top quality-work. I highly recommend him !! </p>",98%,,"Excellent work provided by Kevin. It's worth much more than the price he's selling it, so you won't regret it ! It's top quality-work. I highly recommend him !! ",pos,0.727636545,0.042173903,"['Excellent', 'work', 'provided', 'Kevin', ""'s"", 'worth', 'much', 'more', 'price', ""'s"", 'selling', 'so', 'wo', ""n't"", 'regret', ""'s"", 'top', 'quality-work', 'highly', 'recommend']",Money
1,,Produce 10 very deep SEO and website analysis reports within 24 hours!,Shawna S.,$15,63,"Grand Blanc, United States            ",41,18-Apr-15,5,50,,<p>Thank you very much!</p>,98%,,Thank you very much!,pos,0.740241621,0.181799047,"['Thank', 'very', 'much']",Quality
1,,Produce 10 very deep SEO and website analysis reports within 24 hours!,Dan O.,$15,63,"Espoo, Finland            ",41,18-Apr-15,5,50,,<p>Thanks. Fast service</p>,98%,,Thanks. Fast service,pos,0.697104481,0.269611917,"['Thanks', 'Fast', 'service']",Time
1,,Produce 10 very deep SEO and website analysis reports within 24 hours!,Akwasi B.,$15,63,"Walton, United Kingdom            ",41,17-Apr-15,5,50,,<p>Very impressed with the work</p>,98%,,Very impressed with the work,pos,0.674601336,0.33142959,"['Very', 'impressed', 'work']",Quality
1,,Produce 10 very deep SEO and website analysis reports within 24 hours!,Owen S.,$15,63,"Poole, United Kingdom            ",41,17-Apr-15,5,50,,<p>No problems at all.</p>,98%,,No problems at all.,pos,0.709068963,0.268406342,['problems'],Quality
1,,Produce 10 very deep SEO and website analysis reports within 24 hours!,Derek C.,$15,63,"London, United Kingdom            ",41,11-Apr-15,5,50,,"<p>Once again Kevin delivere3d the goods well within the time limit, very helpful and friendly </p>",98%,,"Once again Kevin delivere3d the goods well within the time limit, very helpful and friendly ",neg,0.272777916,0.44607571,"['Once', 'again', 'Kevin', 'delivere3d', 'goods', 'well', 'time', 'limit', 'very', 'helpful', 'friendly']",Time
1,,Produce 10 very deep SEO and website analysis reports within 24 hours!,Chris N.,$15,63,"Pontypool, United Kingdom            ",41,10-Apr-15,5,50,,<p>Great Report and Speedily delivered</p>,98%,,Great Report and Speedily delivered,pos,0.620068185,0.406730435,"['Great', 'Report', 'Speedily', 'delivered']",Time
1,,Produce 10 very deep SEO and website analysis reports within 24 hours!,Derek C.,$15,63,"London, United Kingdom            ",41,10-Apr-15,5,50,,<p>A real pleasure to work with does pph proud </p>,98%,,A real pleasure to work with does pph proud ,pos,0.644549495,0.160872384,"['real', 'pleasure', 'work', 'does', 'pph', 'proud']",Quality
1,,Produce 10 very deep SEO and website analysis reports within 24 hours!,Derek C.,$15,63,"London, United Kingdom            ",41,10-Apr-15,5,50,,"<p>A great report and  very fast response.  Will be ordering more<br>
</p>",98%,,A great report and  very fast response.  Will be ordering more ,pos,0.709706479,0.205381707,"['great', 'report', 'very', 'fast', 'response', 'Will', 'be', 'ordering', 'more']",Time
3,,Be your SEO Consultant TODAY Chat for 60 mins + Audit + Follow On Plan (2 hrs),Rob S.,$92,5,"Newbury, United Kingdom            ",5,15-Jul-15,5,3,,<p>Really useful in structuring and planning a strategy going forward</p>,100%,,Really useful in structuring and planning a strategy going forward,pos,0.760090059,0.132249845,"['Really', 'useful', 'structuring', 'planning', 'strategy', 'going', 'forward']",Quality
3,,Be your SEO Consultant TODAY Chat for 60 mins + Audit + Follow On Plan (2 hrs),Peter James S.,$92,5,"London, United Kingdom            ",5,10-Jul-15,5,3,,"<p>Great service, would recommend to anyone looking for some friendly advice and guidance relating to SEO.</p>",100%,,"Great service, would recommend to anyone looking for some friendly advice and guidance relating to SEO.",neutral,0.543563028,0.807583468,"['Great', 'service', 'would', 'recommend', 'anyone', 'looking', 'friendly', 'advice', 'guidance', 'relating', 'SEO']",Quality
3,,Be your SEO Consultant TODAY Chat for 60 mins + Audit + Follow On Plan (2 hrs),Quinton W.,$92,5,"Stoke-on-Trent, United Kingdom            ",5,17-Apr-15,5,3,,"<p>Nina is extremely knowledgeable and professional, went above and beyond. I would highly recommend Nina to anyone and everyone.</p>",100%,,"Nina is extremely knowledgeable and professional, went above and beyond. I would highly recommend Nina to anyone and everyone.",pos,0.526296799,0.398341273,"['Nina', 'is', 'extremely', 'knowledgeable', 'professional', 'went', 'would', 'highly', 'recommend', 'Nina', 'anyone', 'everyone']",Quality
